{
  "schema_version": "1.0.0",
  "artifact_hash": "golden-artifact-hash",
  "platform": "torch_ref",
  "model_version": "example",
  "cells": [
    {
      "condition_mode": "glaucoma",
      "platform": "torch_ref",
      "status": "blocked_missing_hazard_labels",
      "status_label": "BLOCKED",
      "metrics": {},
      "gates_failed": ["SG-01", "SG-02"]
    }
  ],
  "all_passed": false,
  "summary": {
    "passed": 0,
    "failed": 0,
    "blocked": 1,
    "skipped": 0,
    "xfailed": 0
  }
}
